{
  "schema_version": "cuav-scenario/1",
  "scenario_id": "golden-03",
  "name": "亚运村三站三源：交叉定位与时差定位",
  "synthetic": true,
  "aoi": {
    "id": "beijing-yayuncun",
    "manifest_sha256": "4e1ed6a830b1d3c07d02513caa16e2b4114f85ba7cbb30dd868cc0f137f192db"
  },
  "coordinate": {
    "crs": "EPSG:4326",
    "alt_ref": "AGL",
    "terrainHeight_m": 0,
    "coord_version": "wgs84-2026-09"
  },
  "time": {
    "basis": "LogicalSim",
    "duration_s": 120
  },
  "seed": 20260909,
  "sites": [
    {
      "id": "site-1",
      "name": "亚运村北站",
      "equipment_model": "窄带侦察接收机",
      "position": {
        "lon": 116.405,
        "lat": 40.001428,
        "alt_m": 30
      },
      "antenna": {
        "gain_dBi": 3,
        "pattern": "omni"
      },
      "receiver": {
        "fs_Hz": 500000,
        "center_Hz": 2440500000,
        "bw_Hz": 400000,
        "nf_dB": 6
      },
      "clock": {
        "sync_sigma_ns": 3,
        "bias_ns": 0,
        "rx_delay_ns": 0,
        "rx_delay_sigma_ns": 0.5,
        "sync_state": "locked"
      }
    },
    {
      "id": "site-2",
      "name": "亚运村西南站",
      "equipment_model": "窄带侦察接收机",
      "position": {
        "lon": 116.392104,
        "lat": 39.984286,
        "alt_m": 30
      },
      "antenna": {
        "gain_dBi": 3,
        "pattern": "omni"
      },
      "receiver": {
        "fs_Hz": 500000,
        "center_Hz": 2440500000,
        "bw_Hz": 400000,
        "nf_dB": 6
      },
      "clock": {
        "sync_sigma_ns": 5,
        "bias_ns": 0,
        "rx_delay_ns": 0,
        "rx_delay_sigma_ns": 0.5,
        "sync_state": "locked"
      }
    },
    {
      "id": "site-3",
      "name": "亚运村东南站",
      "equipment_model": "窄带侦察接收机",
      "position": {
        "lon": 116.417896,
        "lat": 39.984286,
        "alt_m": 30
      },
      "antenna": {
        "gain_dBi": 3,
        "pattern": "omni"
      },
      "receiver": {
        "fs_Hz": 500000,
        "center_Hz": 2440500000,
        "bw_Hz": 400000,
        "nf_dB": 6
      },
      "clock": {
        "sync_sigma_ns": 10,
        "bias_ns": 20,
        "rx_delay_ns": 0,
        "rx_delay_sigma_ns": 1,
        "sync_state": "holdover"
      }
    }
  ],
  "emitters": [
    {
      "id": "uav-1",
      "name": "多旋翼图传下行",
      "equipment_model": "中型多旋翼 · 图传",
      "platform_type": "multirotor",
      "position": {
        "lon": 116.387413,
        "lat": 39.980102,
        "alt_m": 120
      },
      "emission": {
        "center_Hz": 2440500000,
        "bw_Hz": 400000,
        "tx_power_dBm": 27,
        "antenna_gain_dBi": 2,
        "polarization": "vertical",
        "waveform": {
          "type": "tone",
          "offset_Hz": 48828.125
        }
      }
    },
    {
      "id": "uav-2",
      "name": "同频绕飞目标",
      "equipment_model": "轻型多旋翼 · 图传",
      "platform_type": "multirotor",
      "position": {
        "lon": 116.405,
        "lat": 39.996299,
        "alt_m": 90
      },
      "emission": {
        "center_Hz": 2440500000,
        "bw_Hz": 400000,
        "tx_power_dBm": 24,
        "antenna_gain_dBi": 2,
        "polarization": "vertical",
        "waveform": {
          "type": "tone",
          "offset_Hz": 48828.125
        }
      }
    },
    {
      "id": "uav-3",
      "name": "悬停遥控突发",
      "equipment_model": "穿越机 · 遥控",
      "platform_type": "racing",
      "position": {
        "lon": 116.415552,
        "lat": 39.984601,
        "alt_m": 60
      },
      "emission": {
        "center_Hz": 2440500000,
        "bw_Hz": 200000,
        "tx_power_dBm": 20,
        "antenna_gain_dBi": 0,
        "polarization": "vertical",
        "waveform": {
          "type": "burst",
          "offset_Hz": -97656.25,
          "period_s": 0.5,
          "duty": 0.2
        }
      }
    }
  ],
  "routes": [
    {
      "emitter_id": "uav-1",
      "loop": false,
      "waypoints": [
        {
          "position": {
            "lon": 116.387413,
            "lat": 39.980102,
            "alt_m": 120
          },
          "speed_mps": 20
        },
        {
          "position": {
            "lon": 116.40969,
            "lat": 39.9918,
            "alt_m": 140
          },
          "speed_mps": 20
        },
        {
          "position": {
            "lon": 116.422587,
            "lat": 39.999898,
            "alt_m": 120
          },
          "speed_mps": 20
        }
      ]
    },
    {
      "emitter_id": "uav-2",
      "loop": false,
      "waypoints": [
        {
          "position": {
            "lon": 116.405,
            "lat": 39.996299,
            "alt_m": 90
          },
          "speed_mps": 12
        },
        {
          "position": {
            "lon": 116.412108,
            "lat": 39.993149,
            "alt_m": 90
          },
          "speed_mps": 12
        },
        {
          "position": {
            "lon": 116.412108,
            "lat": 39.986851,
            "alt_m": 90
          },
          "speed_mps": 12
        },
        {
          "position": {
            "lon": 116.405,
            "lat": 39.983701,
            "alt_m": 90
          },
          "speed_mps": 12
        },
        {
          "position": {
            "lon": 116.397892,
            "lat": 39.986851,
            "alt_m": 90
          },
          "speed_mps": 12
        },
        {
          "position": {
            "lon": 116.397892,
            "lat": 39.993149,
            "alt_m": 90
          },
          "speed_mps": 12
        },
        {
          "position": {
            "lon": 116.405,
            "lat": 39.996299,
            "alt_m": 90
          },
          "speed_mps": 12
        }
      ]
    },
    {
      "emitter_id": "uav-3",
      "loop": false,
      "waypoints": [
        {
          "position": {
            "lon": 116.415552,
            "lat": 39.984601,
            "alt_m": 60
          },
          "speed_mps": 5,
          "loiter_s": 130
        }
      ]
    }
  ],
  "activities": [
    {
      "emitter_id": "uav-1",
      "t_s": 0,
      "event": "cruise"
    },
    {
      "emitter_id": "uav-1",
      "t_s": 0,
      "event": "tx_on"
    },
    {
      "emitter_id": "uav-2",
      "t_s": 0,
      "event": "cruise"
    },
    {
      "emitter_id": "uav-2",
      "t_s": 0,
      "event": "tx_on"
    },
    {
      "emitter_id": "uav-3",
      "t_s": 0,
      "event": "hover"
    },
    {
      "emitter_id": "uav-3",
      "t_s": 0,
      "event": "tx_on"
    },
    {
      "emitter_id": "uav-2",
      "t_s": 30,
      "event": "tx_off"
    },
    {
      "emitter_id": "uav-2",
      "t_s": 40,
      "event": "tx_on"
    }
  ],
  "zones": [
    {
      "id": "z-east",
      "name": "东侧告警区",
      "kind": "alert",
      "shape": "circle",
      "center": {
        "lon": 116.4105,
        "lat": 39.99
      },
      "radius_m": 400,
      "alt_max_m": 300
    }
  ],
  "trace": {
    "created_by": "实施方（切片 ⑥a，L-2）",
    "created_at": "2026-09-09T00:00:00Z",
    "notes": "多源多站演示场景（D-053）。三站构成边长约 2.2 km 的等边三角形（外接圆半径 1270 m），站钟按建模值给：site-1 3 ns 锁定、site-2 5 ns 锁定、site-3 10 ns 保持态且固定钟差 20 ns——它们是建模的同步误差，不是任何真实设备的时统指标（11 报告 §6.5）。三个源：uav-1 穿越三角形；uav-2 与 uav-1 同中心频率同频偏（故意落在同一个频点上，用来演示同站同频多源的测向混叠），30 s 关 40 s 开；uav-3 悬停发突发，带宽 200 kHz、频偏 −97656.25 Hz（= −200 个 bin，nfft 1024 下落在频点中心，不吃扇贝损耗）。采样率与 golden-01 同为 500 kS/s 的窄带观测口径。发射功率、天线增益、噪声系数为通用取值，非甲方清单，属原型阶段取值（D-028）。"
  }
}
