{
  "schema_version": "cuav-scenario/1",
  "scenario_id": "gfsk-80m",
  "name": "GFSK 族算例：FrSky 与 Futaba S-FHSS 两个遥控器（80 MS/s 宽带）",
  "synthetic": true,
  "aoi": {
    "id": "beijing-yayuncun",
    "manifest_sha256": "4e1ed6a830b1d3c07d02513caa16e2b4114f85ba7cbb30dd868cc0f137f192db"
  },
  "coordinate": {
    "crs": "EPSG:4326",
    "alt_ref": "AGL",
    "terrainHeight_m": 0,
    "coord_version": "wgs84-2026-09"
  },
  "time": {
    "basis": "LogicalSim",
    "duration_s": 1.0
  },
  "seed": 20260929,
  "sites": [
    {
      "id": "site-1",
      "name": "亚运村侦察站（宽带）",
      "position": {
        "lon": 116.405,
        "lat": 39.99,
        "alt_m": 30
      },
      "antenna": {
        "gain_dBi": 3,
        "pattern": "omni"
      },
      "receiver": {
        "fs_Hz": 80000000,
        "center_Hz": 2440000000,
        "bw_Hz": 64000000,
        "nf_dB": 6
      }
    }
  ],
  "emitters": [
    {
      "id": "rc-frsky",
      "name": "FrSky 遥控器（D16 v2 FCC 档）",
      "equipment_model": "FrSky X20",
      "platform_type": "multirotor",
      "position": {
        "lon": 116.411,
        "lat": 39.992,
        "alt_m": 1.5
      },
      "emission": {
        "center_Hz": 2473000000.0,
        "bw_Hz": 191223.14453125,
        "tx_power_dBm": 20,
        "antenna_gain_dBi": 0,
        "waveform": {
          "type": "gfsk",
          "preset_id": "frsky-d16v2-fcc"
        }
      }
    },
    {
      "id": "rc-futaba",
      "name": "Futaba 遥控器（S-FHSS）",
      "equipment_model": "Futaba S-FHSS",
      "platform_type": "multirotor",
      "position": {
        "lon": 116.398,
        "lat": 39.9955,
        "alt_m": 1.5
      },
      "emission": {
        "center_Hz": 2403998657.2265625,
        "bw_Hz": 204315.185546875,
        "tx_power_dBm": 20,
        "antenna_gain_dBi": 0,
        "waveform": {
          "type": "gfsk",
          "preset_id": "futaba-sfhss",
          "frame_offset_s": 0.0021
        }
      }
    }
  ],
  "routes": [],
  "activities": [
    {
      "emitter_id": "rc-frsky",
      "t_s": 0.0,
      "event": "hop",
      "args": {
        "sequence": [
          2473000000.0,
          2407000000.0,
          2411500000.0,
          2416000000.0,
          2420500000.0,
          2425000000.0,
          2429500000.0,
          2434000000.0,
          2438500000.0,
          2443000000.0,
          2447500000.0,
          2452000000.0,
          2456500000.0,
          2461000000.0,
          2465500000.0,
          2470600000.0,
          2404000000.0,
          2408500000.0,
          2413000000.0,
          2417500000.0,
          2422000000.0,
          2426500000.0,
          2431600000.0,
          2435500000.0,
          2440000000.0,
          2444500000.0,
          2449000000.0,
          2453500000.0,
          2458000000.0,
          2462500000.0,
          2467000000.0,
          2471500000.0,
          2405500000.0,
          2410000000.0,
          2414500000.0,
          2419000000.0,
          2423500000.0,
          2428000000.0,
          2432500000.0,
          2437000000.0,
          2441500000.0,
          2446000000.0,
          2450500000.0,
          2455000000.0,
          2459500000.0,
          2464000000.0,
          2468500000.0
        ],
        "dwell_s": 0.007
      }
    },
    {
      "emitter_id": "rc-futaba",
      "t_s": 0.0021,
      "event": "hop",
      "args": {
        "sequence": [
          2403998657.2265625,
          2409997192.3828125,
          2415995727.5390625,
          2421994262.6953125,
          2427992797.8515625,
          2433991333.0078125,
          2439989868.1640625,
          2445988403.3203125,
          2405498291.015625,
          2411496826.171875,
          2417495361.328125,
          2423493896.484375,
          2429492431.640625,
          2435490966.796875,
          2441489501.953125,
          2447488037.109375,
          2406997924.8046875,
          2412996459.9609375,
          2418994995.1171875,
          2424993530.2734375,
          2430992065.4296875,
          2436990600.5859375,
          2442989135.7421875,
          2408497558.59375,
          2414496093.75,
          2420494628.90625,
          2426493164.0625,
          2432491699.21875,
          2438490234.375,
          2444488769.53125
        ],
        "dwell_s": 0.0068
      }
    }
  ],
  "trace": {
    "created_by": "实施方（Q-3 步骤 4，D-089）",
    "created_at": "2026-09-29T00:00:00Z",
    "notes": "Q-3 的回归夹具：两种 GFSK 族遥控同时出现在 80 MS/s @ 2440 MHz 的宽带里（与 DroneRFb 同接收配置，14 §8.1 R1）。rc-frsky 用预设 frsky-d16v2-fcc（GFSK BT 1、76.97 kbaud、57.13 kHz，每 7 ms 一包 2.845 ms），rc-futaba 用 futaba-sfhss（2-FSK、128.14 kbaud、38.09 kHz，每 6.8 ms 同一频点两包、各 1.436 ms），帧起点 2.1 ms。两条 hop 活动由 algos/reference/gfsk_ref.py --hop-activity <预设> --seed 20260929 --emitter <id> --t0 <帧起点> 生成（FrSky 逐跳 +3 格模 47、47 跳一轮；S-FHSS 按 MPM 的 code + 2 规则、30 跳一轮），dwell_s 等于帧周期、活动时刻等于帧起点，于是一帧恰落在一个停留里；emission.center_Hz 取序列第一跳。两个遥控器都在地面定点（离地 1.5 m、不设航线：信道的整数样点时延在移动目标上会逐样点跳变，D-049 ⑥），距站约 0.6 km 与 0.8 km；发射功率 20 dBm（2.4 GHz 遥控常见的 100 mW 档，A）。"
  }
}
