{
  "schema_version": "cuav-scenario/1",
  "scenario_id": "ofdm-emitter",
  "name": "波形源测试用：OFDM 族三种（Q-2）",
  "synthetic": true,
  "aoi": {
    "id": "beijing-yayuncun",
    "manifest_sha256": "4e1ed6a830b1d3c07d02513caa16e2b4114f85ba7cbb30dd868cc0f137f192db"
  },
  "coordinate": {
    "crs": "EPSG:4326",
    "alt_ref": "AGL",
    "terrainHeight_m": 0,
    "coord_version": "wgs84-2026-09"
  },
  "time": {
    "basis": "LogicalSim",
    "duration_s": 1
  },
  "seed": 20260929,
  "sites": [
    {
      "id": "site-1",
      "name": "测试站",
      "position": {
        "lon": 116.405,
        "lat": 39.99,
        "alt_m": 30
      },
      "antenna": {
        "gain_dBi": 3,
        "pattern": "omni"
      },
      "receiver": {
        "fs_Hz": 80000000,
        "center_Hz": 2440000000,
        "bw_Hz": 64000000,
        "nf_dB": 6
      }
    }
  ],
  "emitters": [
    {
      "id": "video",
      "name": "图传 10 MHz",
      "platform_type": "multirotor",
      "position": {
        "lon": 116.41,
        "lat": 39.99,
        "alt_m": 50
      },
      "emission": {
        "center_Hz": 2441300000,
        "bw_Hz": 9015000,
        "tx_power_dBm": 20,
        "antenna_gain_dBi": 0,
        "waveform": {
          "type": "ofdm",
          "preset_id": "dji-video-10m"
        }
      }
    },
    {
      "id": "droneid",
      "name": "DroneID",
      "platform_type": "multirotor",
      "position": {
        "lon": 116.41,
        "lat": 39.99,
        "alt_m": 50
      },
      "emission": {
        "center_Hz": 2438500000,
        "bw_Hz": 9015000,
        "tx_power_dBm": 20,
        "antenna_gain_dBi": 0,
        "waveform": {
          "type": "droneid",
          "preset_id": "dji-droneid"
        }
      }
    },
    {
      "id": "uplink",
      "name": "上行 2.2 MHz",
      "platform_type": "multirotor",
      "position": {
        "lon": 116.41,
        "lat": 39.991,
        "alt_m": 1.5
      },
      "emission": {
        "center_Hz": 2423300000.0,
        "bw_Hz": 2235000,
        "tx_power_dBm": 20,
        "antenna_gain_dBi": 0,
        "waveform": {
          "type": "ofdm",
          "preset_id": "dji-uplink-2m"
        }
      }
    },
    {
      "id": "video-gated",
      "name": "图传 10 MHz，1 ms 处开、6 ms 处关",
      "platform_type": "multirotor",
      "position": {
        "lon": 116.41,
        "lat": 39.99,
        "alt_m": 50
      },
      "emission": {
        "center_Hz": 2441300000,
        "bw_Hz": 9015000,
        "tx_power_dBm": 20,
        "antenna_gain_dBi": 0,
        "waveform": {
          "type": "ofdm",
          "preset_id": "dji-video-10m"
        }
      }
    }
  ],
  "routes": [],
  "activities": [
    {
      "emitter_id": "uplink",
      "t_s": 0,
      "event": "hop",
      "args": {
        "sequence": [
          2423300000.0,
          2420300000.0,
          2420300000.0,
          2414300000.0,
          2414300000.0,
          2414300000.0,
          2474300000.0,
          2474300000.0,
          2423300000.0,
          2423300000.0
        ],
        "dwell_s": 0.002
      }
    },
    {
      "emitter_id": "video-gated",
      "t_s": 0.001,
      "event": "tx_on"
    },
    {
      "emitter_id": "video-gated",
      "t_s": 0.006,
      "event": "tx_off"
    }
  ],
  "trace": {
    "created_by": "实施方（Q-2 步骤 7，D-088）",
    "created_at": "2026-09-29T00:00:00Z",
    "notes": "SceneEmitterSource 的 OFDM 族单测夹具：80 MS/s @ 2440 MHz；图传 10 MHz 偏 +1.3 MHz，DroneID 自 t = 0 起、偏 −1.5 MHz，上行 2.2 MHz 跳频（algos/reference/ofdm_ref.py --uplink-sequence dji-uplink-2m --seed 7 --slots 10），另一路图传在 1 ms 开、6 ms 关，用来验整突发开关。"
  }
}
