{
  "schema_version": "cuav-scenario/1",
  "scenario_id": "noise-band",
  "name": "带限噪声测试用（C-8）",
  "synthetic": true,
  "aoi": {
    "id": "beijing-yayuncun",
    "manifest_sha256": "4e1ed6a830b1d3c07d02513caa16e2b4114f85ba7cbb30dd868cc0f137f192db"
  },
  "coordinate": {
    "crs": "EPSG:4326",
    "alt_ref": "AGL",
    "terrainHeight_m": 0,
    "coord_version": "wgs84-2026-09"
  },
  "time": {
    "basis": "LogicalSim",
    "duration_s": 10
  },
  "seed": 20260915,
  "sites": [
    {
      "id": "site-1",
      "name": "测试站",
      "position": {
        "lon": 116.405,
        "lat": 39.99,
        "alt_m": 30
      },
      "antenna": {
        "gain_dBi": 3,
        "pattern": "omni"
      },
      "receiver": {
        "fs_Hz": 1000000,
        "center_Hz": 2440500000,
        "bw_Hz": 800000,
        "nf_dB": 6
      }
    }
  ],
  "emitters": [
    {
      "id": "uav-1",
      "name": "带限噪声源",
      "platform_type": "multirotor",
      "position": {
        "lon": 116.4035,
        "lat": 39.9885,
        "alt_m": 50
      },
      "emission": {
        "center_Hz": 2440600000,
        "bw_Hz": 200000,
        "tx_power_dBm": 20,
        "antenna_gain_dBi": 0,
        "waveform": {
          "type": "noise"
        }
      }
    }
  ],
  "routes": [
    {
      "emitter_id": "uav-1",
      "loop": false,
      "waypoints": [
        {
          "position": {
            "lon": 116.4035,
            "lat": 39.9885,
            "alt_m": 50
          },
          "speed_mps": 5,
          "loiter_s": 20
        }
      ]
    }
  ],
  "activities": [],
  "trace": {
    "created_by": "实施方（C-8 测试夹具）",
    "created_at": "2026-09-15T00:00:00Z",
    "notes": "1 MS/s 采样、带宽 200 kHz 的噪声，中心比观测中心高 100 kHz：既验带限（占用带宽 ≈ 200 kHz），也验频率搬移（谱的质心落在 +100 kHz）。"
  }
}
