{
  "schema_version": "cuav-scenario/1",
  "scenario_id": "ofdm-80m",
  "name": "OFDM 族算例：DJI 图传 + DroneID + 遥控上行（80 MS/s 宽带）",
  "synthetic": true,
  "aoi": {
    "id": "beijing-yayuncun",
    "manifest_sha256": "4e1ed6a830b1d3c07d02513caa16e2b4114f85ba7cbb30dd868cc0f137f192db"
  },
  "coordinate": {
    "crs": "EPSG:4326",
    "alt_ref": "AGL",
    "terrainHeight_m": 0,
    "coord_version": "wgs84-2026-09"
  },
  "time": {
    "basis": "LogicalSim",
    "duration_s": 1.0
  },
  "seed": 20260929,
  "sites": [
    {
      "id": "site-1",
      "name": "亚运村侦察站（宽带）",
      "position": {
        "lon": 116.405,
        "lat": 39.99,
        "alt_m": 30
      },
      "antenna": {
        "gain_dBi": 3,
        "pattern": "omni"
      },
      "receiver": {
        "fs_Hz": 80000000,
        "center_Hz": 2440000000,
        "bw_Hz": 64000000,
        "nf_dB": 6
      }
    }
  ],
  "emitters": [
    {
      "id": "uav-1",
      "name": "DJI 图传下行（20 MHz，A/D/F/G 族时序）",
      "equipment_model": "DJI 20 MHz 图传",
      "platform_type": "multirotor",
      "position": {
        "lon": 116.4167,
        "lat": 39.99,
        "alt_m": 100
      },
      "emission": {
        "center_Hz": 2462500000,
        "bw_Hz": 18015000,
        "tx_power_dBm": 20,
        "antenna_gain_dBi": 2,
        "waveform": {
          "type": "ofdm",
          "preset_id": "dji-video-20m-a"
        }
      }
    },
    {
      "id": "uav-1-droneid",
      "name": "同一架机的 DroneID",
      "equipment_model": "DJI DroneID",
      "platform_type": "multirotor",
      "position": {
        "lon": 116.4167,
        "lat": 39.99,
        "alt_m": 100
      },
      "emission": {
        "center_Hz": 2414500000,
        "bw_Hz": 9015000,
        "tx_power_dBm": 20,
        "antenna_gain_dBi": 2,
        "waveform": {
          "type": "droneid",
          "preset_id": "dji-droneid",
          "frame_offset_s": 0.1
        }
      }
    },
    {
      "id": "rc-1",
      "name": "遥控器上行（2.2 MHz 跳频）",
      "equipment_model": "DJI 遥控器",
      "platform_type": "multirotor",
      "position": {
        "lon": 116.411,
        "lat": 39.992,
        "alt_m": 1.5
      },
      "emission": {
        "center_Hz": 2441300000.0,
        "bw_Hz": 2235000,
        "tx_power_dBm": 20,
        "antenna_gain_dBi": 0,
        "waveform": {
          "type": "ofdm",
          "preset_id": "dji-uplink-2m"
        }
      }
    }
  ],
  "routes": [],
  "activities": [
    {
      "emitter_id": "rc-1",
      "t_s": 0,
      "event": "hop",
      "args": {
        "sequence": [
          2441300000.0,
          2435300000.0,
          2435300000.0,
          2435300000.0,
          2435300000.0,
          2435300000.0,
          2459300000.0,
          2459300000.0,
          2429300000.0,
          2429300000.0,
          2429300000.0,
          2462300000.0,
          2462300000.0,
          2423300000.0,
          2423300000.0,
          2423300000.0,
          2417300000.0,
          2417300000.0,
          2447300000.0,
          2447300000.0,
          2447300000.0,
          2426300000.0,
          2426300000.0,
          2423300000.0,
          2423300000.0,
          2423300000.0,
          2444300000.0,
          2444300000.0,
          2441300000.0,
          2441300000.0
        ],
        "dwell_s": 0.002
      }
    }
  ],
  "trace": {
    "created_by": "实施方（Q-2 步骤 6，D-088）",
    "created_at": "2026-09-29T00:00:00Z",
    "notes": "Q-2 的回归夹具：三种 OFDM 族信号同时出现在 80 MS/s @ 2440 MHz 的宽带里（与 DroneRFb 同接收配置，14 §8.1 R1）。uav-1 是 20 MHz 图传（预设 dji-video-20m-a，信道取实测最常见的 2453.5–2471.5 MHz 的中心 2462.5 MHz）；uav-1-droneid 是同一架机的 DroneID（与图传同位置，因评价器一源一标签而单列一个辐射源，D-088 ④），2414.5 MHz、帧起点 0.1 s；rc-1 是地面遥控器的上行（dji-uplink-2m），跳频序列由 algos/reference/ofdm_ref.py --uplink-sequence dji-uplink-2m --seed 20260929 --slots 30 生成，dwell_s = 时隙长 2 ms，60 ms 一循环。三个源都定点悬停、不设航线：信道的整数样点时延在移动目标上会逐样点跳变，落进 OFDM 符号中间就是一次人为的相位突跳（D-049 ⑥），悬停使时延恒定。发射功率取 20 dBm（DJI 规格页的 CE / SRRC 档，14 §2.1），距站约 1 km 与 0.6 km。"
  }
}
